{
  "schema_version": 4,
  "workflow": "specdev",
  "active": [
    {
      "change": "2026-08-09-review-all-git-changes",
      "current_work": null,
      "works_run": [
        "specdev/grill-with-docs",
        "specdev/spec",
        "specdev/tickets",
        "specdev/goal-plan"
      ]
    },
    {
      "change": "2026-08-10-fix-toolbox-command-context-and-blame-layout",
      "current_work": "specdev/implement",
      "works_run": [
        "specdev/triage",
        "specdev/diagnose-bugs",
        "specdev/spec",
        "specdev/tickets",
        "specdev/implement"
      ]
    },
    {
      "change": "2026-08-10-copy-ranges-and-aggregate-git-review",
      "current_work": null,
      "works_run": ["specdev/implement"]
    }
  ],
  "archived": []
}
